<personnes xmlns:xsi="http://www.w3.org/2001/XMLSchema-instance"
    xsi:noNamespaceSchemaLocation="com/oozeander/xsd/personnes.xsd">

    <personne1 value="billel"/>
    <personne2 id="1">Billel</personne2>
    <personne3 id="1">
        <nom>KETROUCI</nom>
        <prenom>Billel</prenom>
        <date>1996-09-09</date>
    </personne3>
    <personne4>
        <nomComplet>Billel KETROUCI</nomComplet>
        <skills>
            <skill>Java</skill>
            <skill>Hibernate</skill>
            <skill>JAXB</skill>
            <skill>Spring</skill>
            <skill>Angular</skill>
        </skills>
    </personne4>
    <personne5>
        <nomComplet>Billel KETROUCI</nomComplet>
        <skills>billel bakay meriem</skills>
    </personne5>
    <personne6>
        <nomComplet>Billel KETROUCI</nomComplet>
        <!--<nomEtPrenom>
            <nom>KETROUCI</nom>
            <prenom>Billel</prenom>
        </nomEtPrenom>-->
    </personne6>
    <personne7>
        <date>1996-09-09</date>
        <nomEtPrenom>
            <nom>KETROUCI</nom>
            <prenom>Billel</prenom>
        </nomEtPrenom>
    </personne7>
    <personne8>
        <initial>BK</initial>
        <anneeDeNaissance>1996</anneeDeNaissance>
        <profession>Developpeur</profession>
        <motDePasse>MonMotDePasse</motDePasse>
    </personne8>

</personnes>